	artist	lyrics
0	Heavy D	"Is it good to you baby, cause I like it
Is it good to you baby
Cause I like the way you feel

Lay down and relax
Kick off your shoes
I got what you've been waitin' for and more
No more waitin' its time your all mine
So take your time and do 
It right tonight

So if you're ready
And you want it yeah
Come and get it boy
Cause I'm with it
And I won't hold back the 
Feelings I feel
Cause boy its real, so real
So tell me how it feels, baby

Is it good to you baby, cause I like it
Is it good to you baby
Cause I like the way you feel

Oooh, you look so good
Lyin' here
To run my fingers through
Your hair, baby
And if makin' love is your dream
With no other but me
Come and get what you 
Been waitin' for

But take it nice and slow
Don't rush it
Then go round and round
Then push it
Cause I like the way
You feel my body hey
Its feels good baby
So good, but tell me 

Is it good to you baby, cause I like it
Is it good to you baby
Cause I like the way you feel
"
1	Heavy D	"[Heavy D] 
Yea this is uh Super funk you know what I'm sayin
This is for all the players and playetts wherever you at you dig
I'm talkin about from this side to that side 
East side, West side, your side, my side
It's all about being funky man
Aiyyo give me that microphone
It's Heavy D the baritone and I'm home alone dig it 
and I'm always staying freshly dipped on 1-2-5th 
where the dogs bark and the dreadlock be sparkin spliff
Okay okay okay okay it's Heavy D again
Hallelujah I'm on your T.V. screen again
You see me on your MTV and on your BET 
and on your local focal point video show
Nigga this how it flow so fly like an eagle
No sequels no weed but I get love from all the thugs 
cause they still my people 
I'm dynamic punks panic when they see me
They get all shook up when my mic's hooked up 
Let's get it on! 

[chorus]x2 
Untouchables at your door 
(Let's get it on) 
All you wack rappers hit the floor 

[2pac]
How should I plead forever thuggin on a quest to get G's
Runnin from enemies ever since the days of a seed
I'm under pressure the stress will have me drinkin
thinkin niggaz after me much too paranoid to blink
Wonder why the police don't want to see me stackin G's
They after a playa but I won't let em capture me
I gotta thank the lord for the weed and the nicotine 
I can't sleep close my eyes I see wicked deams (deamons)
I keep my pistol by my bedside one in the chamber
Preoccupied with homocide my life's in danger
Rollin down the four-five beware of stangers 
Hand on my 4-5 that's what the fame does
I'm probably wrong but I'll never know it till I'm gone
From out the ghetto where the jealous motherfuckers roam
Pass the weed let that Hennessey get to me 
before the penitentiary 
Let's get it on!! 

[chorus]x2 
Untouchables at your door 
(Let's get it on) 
All you wack rappers hit the floor 

[Grand Puba]
I thought you knew I stay true to this rhyme thing I do 
I have all the honeys saying, ""Go Pu'!"" 
I flip a style from the projects building 70 apartment 6C
I turn food stamps to green stamps rough power amps 
and sold weed under corner lamps but now I'm just microphone talkin
So when you see my ass have my cash or just keep walking
Niggaz got more game than Genesis
Seen a movie in L.A. now everybody want to see 
but them youth don't trouble we 
because they fall victim to what they see hey! 
I keeps it +Reel to Reel+ like my last album title song 
but I understand it takes a year for niggaz to catch on
(hit em in the head dog) So let's get it on! yea 

[Notorious B.I.G.] 
Split the dutches fill it with the skunk we about to 
get wicked in the joint uh Notorious is glorious 
*cough, cough)*
Niggaz now who's the mind blower, the weed grower 
Have you seeing doubles like Noah, the rhyme flower 
B.I.G. top notch with the glock check your pockets 
and your sock it's just the way my pops taught me 
When you throw the drop check em thoroughly 
The bastard might spin around and try to bury me
And dead niggaz don't make no moves
When I'm slingin in the hood I don't fake no moves aight
Reminiscin on my swingin days 
when I drove a Caddy and my bitch sported finger waves
Yea she had the Gucci boots I had Sarducci suits
Oshkosh-begosh Coca-Cola lookin real cute
Junior M.A.F.I.A. representin Bucktown
Mac-11 cocked back niggaz better duck down
Face down you know the routine the cream
Earrings you know the drama Biggie bring
Let's get it on"
2	Heavy D	"[Chorus]
It was written, up in the book of life
That man shall, endure forever more
And it was written, up in the book of life
That man shall, endure forever more

Well did you know the pen is stronger than the knife
They can kill you once but they can't kill you twice
Did you know destruction of the flesh 
Is not the ending to life fear not of the Anti-Christ

Did you know that I exist before the earth
And did you know my eyes are windows to the world
Did you know you can't go a Zion and a wear Jerry curls
Can't tell the boys from the girls

Your bodies just a vehicle transporting the soul
It's what's inside people, is beauty to behold
Fear not of evil, every day dem flesh it grow old
Changes of the time take toll

[Chorus]

It is told that once this greasy order
Is form it comes into a young man's world
And two of dem is like a soldier
That joins the thunder is a wonder

One's attack is like a blunder
One is luckily a stranger
Dem both was born like Jesus inna manger
So join the thunder that's savin' our world

A vester on his chest and Rastafarian is his name
A gift of everlasting life for us to all sustain
Blessing that you all be got, lessons taught you all forgot
Rasta call I shit you not, do you remember Elijah
And his chariot of flames, same blood that runs through my veins

Watch for sticks and stones stumbling blocks and piles
Life is one big road miles on top of miles
So blessed be the soul that always remains a child
And most people don't even smile there's a natural mystic

Blowing in through the air so keep it realistic and always be aware
The truth is crying out and it's so loud and clear, 
But most people won't even hear spiritual pollution is in the atmosphere
And with so much confusion can one be happy here
The gift of Rastafari is for all man to share
But some would rather to be so unfair

[Chorus]"
3	Heavy D	"[Chorus]
It was written, up in the book of life
That man shall, endure forever more
And it was written, up in the book of life
That man shall, endure forever more

Well did you know the pen is stronger than the knife
They can kill you once but they can't kill you twice
Did you know destruction of the flesh 
Is not the ending to life fear not of the Anti-Christ

Did you know that I exist before the earth
And did you know my eyes are windows to the world
Did you know you can't go a Zion and a wear Jerry curls
Can't tell the boys from the girls

Your bodies just a vehicle transporting the soul
It's what's inside people, is beauty to behold
Fear not of evil, every day dem flesh it grow old
Changes of the time take toll

[Chorus]

It is told that once this greasy order
Is form it comes into a young man's world
And two of dem is like a soldier
That joins the thunder is a wonder

One's attack is like a blunder
One is luckily a stranger
Dem both was born like Jesus inna manger
So join the thunder that's savin' our world

A vester on his chest and Rastafarian is his name
A gift of everlasting life for us to all sustain
Blessing that you all be got, lessons taught you all forgot
Rasta call I shit you not, do you remember Elijah
And his chariot of flames, same blood that runs through my veins

Watch for sticks and stones stumbling blocks and piles
Life is one big road miles on top of miles
So blessed be the soul that always remains a child
And most people don't even smile there's a natural mystic

Blowing in through the air so keep it realistic and always be aware
The truth is crying out and it's so loud and clear, 
But most people won't even hear spiritual pollution is in the atmosphere
And with so much confusion can one be happy here
The gift of Rastafari is for all man to share
But some would rather to be so unfair

[Chorus]"
4	Heavy D	"Black coffee, no sugar, no cream
That's the kind of girl I need down with my team
Black coffee, no sugar, no cream
That's the kind of girl I need down with my team

Black coffee, no sugar, no cream
That's the kind of girl I need down with my team
Black coffee, no sugar, no cream
It's just the way I like it

I need a girl who ain't scared to scrap
Someone who got my back
Gotta be a dark skin, a light skin
Like the type of girl that stays busy all day

But when the sun goes down
She's my sexy soufle
Somebody real who ain't afraid to work it
If you try to disrespect her face

Around and get her feelings hurt
She ain't [unverified] from your [unverified]
She'll only flex with a brother that can handle it, a
And I don't care if she's a little bit jealous

She can still be a lady while she's coolin' with the fellas
An intellectual, beautiful, sexual
Hands on her hip and when she flips she's incredible
Candlelight [unverified] from her mack

But she's a trooper if she has to spill the beans from the can
A very nice girl but not mistaken for no softy
And that's the way I like it, yeah, my black coffee

Black coffee, no sugar, no cream
That's the kind of girl I need down with my team
Black coffee, no sugar, no cream
That's the kind of girl I need down with my team

Black coffee, no sugar, no cream
That's the kind of girl I need down with my team
Black coffee, no sugar, no cream
It's just the way I like it

Black coffee got the flip like a mitten
Roars like a lion and when I stroke her kitten
Versatile when the coke gets mine
She got a positive style ain't had none in a while

Party animal but Biggie only when she with me
And I don't have to worry 'cause she won't disrespect me
She's everything that a man dreams about
And when I'm with my crew she's all I talk about, hey

Fancy here, jewels all flushed
Backside bigger than a mob but don't touch her
Prettiest girl she know the ones with the slip
A closet full of gear so you know she stay [unverified]

Body so smooth from using plenty lotion
Perfume smelling like some old sex potion
A very nice girl but not mistaken for no softy
And that's the way I want it, yeah, my black coffee

Black coffee, no sugar, no cream
That's the kind of girl I need down with my team
Black coffee, no sugar, no cream
That's the kind of girl I need down with my team

Black coffee, no sugar, no cream
That's the kind of girl I need down with my team
Black coffee, no sugar, no cream
It's just the way I like it

Break it down
Black coffee, no sugar, no cream
Black coffee, no sugar, no cream
Black coffee, no sugar, no cream
Black coffee, no sugar, no cream

Black coffee, the African queen
Part of [unverified] Afro-American dream
Enough respect, I'm diggin' intellect
Appreciate the fact that you never miss a step

The backbone of the black bone here's to ya
As long as I'm around believe me none could ever do ya
You warm, considerate and far from a softie
And that's why I love ya, you're my black coffee

Black coffee, no sugar, no cream
That's the kind of girl I need down with my team
Black coffee, no sugar, no cream
Hey that's the kind of girl I need down with my team

Black coffee, no sugar, no cream
Uh that's the kind of girl I need down with my team
Black coffee, no sugar, no cream
It's just the way I like it

Black coffee, no sugar, no cream
Uh that's the kind of girl I need down with my team
Black coffee, no sugar, no cream
Hey that's the kind of girl I need down with my team

Black coffee, no sugar, no cream
Hey that's the kind of girl I need down with my team
Black coffee, no sugar, no cream
It's just the way I like it

Black coffee, no sugar, no cream
Black coffee, no sugar, no cream
Black coffee, no sugar, no cream
Black coffee, no sugar, no cream
It's just the way I like it

Black coffee, no sugar, no cream
Black coffee, no sugar, no cream
Black coffee, no sugar, no cream
Black coffee, no sugar, no cream
It's just the way I like it

Black coffee, no sugar, no cream
Black coffee, no sugar, no cream
Black coffee, no sugar, no cream
Black coffee, no sugar, no cream
It's just the way I like it"
5	Heavy D	"Yeah (yeah-eah)
(Now that we found love what are we gonna do)
(what are we gonna do) (with it) (with it)
(Now that we found love what are we gonna do)
(hey-eay) (with it)

(Now) One two, tell me what you got
Let me slip my quarters inside your slot to hit the jackpot
Rev me up rev me up
My little buttercup
We can tug sheets snuggle up and get stuck
Believe it or not
Here comes the brother with glow
A strugglin', bubblin' overweight lover hurt prone
So what's it gonna be
Me or the TV
Now let me take time to set your mind and your body free
(Now) So why don't you just stretch
Stretch for a sec
Played ? so I could cop a quick rec
Shake me, Shake me
Baby baby bake me
No need to fake here I am
Come on and take me
Wind your body
Baby move your body
I see you slip sliding
Come on now do it hottie
I'm not quite sure as to what is going down
But I'm feeling Hunky Dory
'bout this thing that I found

(Now that we found love what are we gonna do with it)
(Now that we found love what are we gonna do
With it) (come on Heavy, come on Heavy)

(Now) I dig the way you wiggle
You don't jiggle
Once you jiggle
So hand over your love
Cause it's heavier
Than it'll
Move her like a mover
She wanted to groove so I grooved her
Then she wanted to learn so we did school
And I schooled her
(Now)(Mary had a little lamb)
But not like this
We can waltz and turn
Rumble tumble and twist
Then you think you gonna give in
Fantasies relivin'
So lay down and relax
(yeah baby, that's it)
(now) Lover my lady
Lady love of my baby girl
Spread your wings
So we can fly around the world
Harmony, charm of me
Your fingertips are callin me
When you drop me kisses
You're so cute you drop the bomb on me
(Now) Stretch it, stretch it
Flex it, flex it
Gimme the permission
Okey, dokey
I'll bless ya
Blessin' like Buddha
Buddha as the bless
You can lay down on the Lover
Put your head on my chest (now that we)

(Now that we found love what are we gonna do)
(what are we gonna do) uh, yeah (with it) (with it) uh
(Now that we found love what are we gonna do)
(come on and tell me) (with it) TR, get em up one time

(Now) Uh, keep it funky
Yeah (keep it smooth) like this
(Now) Uh, here we go

(Now) What can we do
What are we gonna do
Roses are red and Violets are blue
Love is good and plenty
If you get plenty good lovin'
Kiss you where you're hot
To what I got to keep you bubblin'
(Now) Do me right
Do me right
My lonesome dove
Tell me one more time
What is this thing called love
I'm not quite sure
As to what is going down
But I'm feelin' Hunkey Dory
'Bout this thing that I found (yeah)

(Now that we) (now that we) (found love
What are we gonna do) (girl tell me) tell me
(with it) (what are we gonna do with this)
Teddy Riley in the house
(Now that we found love) see'mon, see'mon (what are we gonna do)
G Wiz, DJ NF (tell me what are we gonna do with this)
(with it) let's flex

(Now that we found love) see'mon, see'mon (what are we gonna do)
Yeah (tell me somebody got to tell me) (with it) and you don't stop, keep it on
(Now that we found love) (I need to know) see'mon, see'mon (what arewe gonna do)
(somebody got to tell me, got to tell me) yeah (with it)

(what are we gonna do with this love, oh sweet love) 
Yeah (oh love) see'mon
Oh yeah, uh shake it shake it
(Now) oh yeah, uh
(c'mon do the right thing baby) shake it, shake it

Uh (Now that we found love what are we gonna do) here we go
(with it) keep it funky for me (somebody need to tell me)
(Now that we found love) put your hands together, see'mon
(what are we gonna do) uh, uh (I don't know baby) (with it)
(I don't know babe) bring it back one time

(Now) All up in money
My furnish was decades
You hear what I'm sayin'
Oakland, Bronx, Queens, Manhattan
(what are we, what are we gonna do)
The whole New York City
I said I love you to death
And you don't stop
And you don't quit
You got keep it on to the dip dip
Do it like this
And you don't stop
And you don't quit
(what are we, what are we gonna do)
You got keep it on and on and on and on

(Now) Uh yeah yeah aye aye, ha ha
Huh, (c'mon) oh yeah
(Now that we found love what are we gonna do with it)"
6	Heavy D	"Yo man, you ready to drop this, man? (Yeah-eee)
Well kick it for me one time

(Pass)
(Drop it)

We got our own thang (get up and do my thing)
We got our own thang (a diddley-diddley-diddley-diddely-diddely-dee)
We got our own thang (pass)
We got our own thang
We've got our own thang (drop it)

We got our own thang (a diddley-diddley-diddley-diddely-diddely-dee)
We got our own thang (a diddley-diddley-diddley-diddely-diddely-dee)
We got our own thang (a diddley-diddley-diddley-diddely-diddely-dee)
We got our own thang (get up and do my thing)

(Hey!) everybody, shake your body
We don't ill, we chill at a party
Keep a groove that's sensual, three-dimensional
Unquestionable, the lover is professional
Got a category, my own and I'm the president
Don't be alarmed but I'm sewing up the resident
With my particular style-style, particular
Extracurricular, smoother and trickier
Throwing up lyrics like you throw up a flapjack
You're a Chicken McNugget and I'm a Big Mac
Brainstorm soloist, have a Coca-cola with it
Doing very well 'cause I took the right road to this
Path
Maker, undertaker, record breaker
Get up on the floor and do the Heavy D shake
Started with a pow and I'ma end it with a bang (yo)
We got our own thang

We got our own thang (a diddley-diddley-diddley-diddely-diddely-dee)
We got our own thang (a diddley-diddley-diddley-diddely-diddely-dee)
We got our own thang (a diddley-diddley-diddley-diddely-diddely-dee)
We got our own thang (get up and do my thing)

(Hey!) picture the set, girlies wet with sweat
In the corner people sitting down
They've had as much as they could possibly get
Meanwhile I'm lampin', feelin' like a champ and
Push up on a cutie, phone digits I'm stampin'
The place was packed though, stuffed like an Oreo
Everybody broke for a Heavy D video
Pumpin' in stereo
People said, ""Here we go""
A cutie down in front said
""Heavy, you're my hero""
Understand this, before you make a comment
There's always a meaning in a Heavy D statement
In this life, I strive for improvement
Be your own guide, follow your own movement
Love is a legend
Me, I'm legendary at it
Flipping on the mic makes me a rapping acrobat
Don't try to swing, 'cause you couldn't even hang (yo)
We got our own thang

We got our own thang (a diddley-diddley-diddley-diddely-diddely-dee)
We got our own thang (a diddley-diddley-diddley-diddely-diddely-dee)
We got our own thang (a diddley-diddley-diddley-diddely-diddely-dee)
We got our own thang (a diddley-diddley-diddley-diddely-diddely-dee)

He-He-Heavy D
He-He-Heavy D
He-He-Heavy D (get up and do my thing)
He-He-Heavy D
He-He-Heavy D
He-He-Heavy D
Heavy D

Original, individual, smooth criminal
Dance a lot, dance a little
Shuffle to the middle
Don't clock anybody, let 'em all clock you
Don't be down with anybody, let 'em all be down with you
Stay self-managed, self-kept, self-taught
Be your own man, don't be borrowed, don't be bought
Started with a pow and I'ma end it with a bang (yo)
We got our own thang

We got our own thang (a diddley-diddley-diddley-diddely-diddely-dee)
We got our own thang (a diddley-diddley-diddley-diddely-diddely-dee)
We got our own thang (a diddley-diddley-diddley-diddely-diddely-dee)
We got our own thang (a diddley-diddley-diddley-diddely-diddely-dee)
(We got our own)

We got our own thang (a diddley-diddley-diddley-diddely-diddely-dee)
We got our own thang (a diddley-diddley-diddley-diddely-diddely-dee)
We got our own thang (a diddley-diddley-diddley-diddely-diddely-dee)

We got our own thang, baby
You gotta move your body
Come on, baby

We got our own thang (a diddley-diddley-diddley-diddely-diddely-dee)
We got our own thang (a diddley-diddley-diddley-diddely-diddely-dee)"
7	Heavy D	"Weh mi wife dem mi waan see mi pretty wife hey, seh hello baby how yuh doin?
Yay! (Yay!) Yay! (Yay!) A zagga zagga zunga zeh, yay! A zagga zagga zunga zeh!
(Whoa oh oh!)

Well mi nah get nuh sleep at night unless mi deh wid mi girlfriend, yay! (Yay!)
So mi nah get nuh sleep at all because she live long distance, yay! (Yay!)
Seh mi could a tek a plain or a choo choo train
But money haffi mek until mi see har again
So I work all night all day fah mi long distance girlfriend, yay! (Yay!)
'Cause when your far away from home, I'm alone with no one to hold
But I will wait till I'm with you cause you know how to do me, hey!!!

[Chorus]
Baby (Hey!) Long distance girlfriend (Hey!)
Baby (Hey!) Long distance girlfriend (Hey!)
Baby (Hey!) Long distance girlfriend (Hey!)

I'm gonna buy a dozen of rose for my long distance girlfriend, hey! (Yay!)
I'm gonna sing a sweet love song for my far away baby, yay! (Yay!)
And when she touch down, a she where di crown
A pure smile nuh frown, when she come around
And there's no other love but my long distance girlfriend, well, yay! (Whoa oh oh!)
'Cause when your far away from home, I'm alone with no one to hold
But I will wait till I'm with you cause you know how to do me, hey!!!

[Chorus]

Well mi nah get nuh sleep at night unless mi deh wid mi girlfriend, yay! (Yay!)
So mi nah get nuh sleep at all because she live long distance, yay! (Yay!)
Seh mi woulda tek a plain or a choo choo train
But money haffi mek until mi see har again
So I work all night all day fah mi long distance girlfriend, yay! (Yay!)
'Cause when your far away from home, I'm alone with no one to hold
But I will wait till I'm with you 'cause you know how to do me, hey!!!

[Chorus]

Hey! Hey! A zagga zagga zunga zeh, a zagga zagga zunga zeh, Hey! (Yay!)
Hey! Hey! A zagga zagga zunga zeh, a zagga zagga zunga zeh, Hey! (Yay!)
Hey! Hey! A zagga zagga zunga zeh, a zagga zagga zunga zeh, Hey! (Yay!)
Hey! A zagga zagga zunga zeh, a zagga zagga zunga zeh, Hey! (Yay!)"
8	Heavy D	"Ha ha, yeah, Big Bub, nine seven
Yo, Latifah, do you...

[Queen Latifah]
We used to dream of a nice hot cruise for weeks
While my high sex drive rocks you to sleep
Watching mystic continuously 
Your stock rose immediately when you was with me
You wanted the lace, the leather
Since the days I had the jetta
You chased the chedder
And like whatever we face, and whether double ballers
They ain't no playa's till they saw us
Pushing the tall bus; tell 'em we're twin porche's

[Big Bub]
Girl, I am diggin' you
You're diggin' me
Let's make this happen
The things I want to do to you 
Your mind just can't imagine
I want to show you bigger faces
Take you different places
I need you in my life 
So, baby, won't you be my lady?

[Big Bub]
I want your love (yeah)
I need your love
I need you with me
I want your love (yeah)
I need your love
Oh, baby

I'm on another level
Can't you see that I'm no player?
Meet your desires
Take you higher like an elevator
And here's the bottom line
No one can ever love you better
If you like what you're hearing 
Girl, let's get together

I want your love (oh yeah)
I need your love
I need you with me
I want your love (yeah)
I need your love
I'll give a million dollars to have you, babe

I want your love (oh yeah, yeah)
I need your love
Because I need your love, yeah
I want your love (oh yeah)
I need your love 
Heavy, heavy, heavy, yeah

[Heavy D]
Hey yo, boo
You take some time and vibe with me
Now jump in the car and ride with me
She said: ""water bed, I like when you inside of me.""
'Cause you belly all big, and you so fly to me
Now shorty takes trips and various whips
Her phone flips; likes style lavish
Playin' the cabin
Word the mother 
That's my nigga, Big Bub
I want your love
I need your love

[Big Bub]
Whoa baby, yeah 
I want your love (yeah)
I need your love
I'll give a million dollars to have you
I want your love (Yes I will, baby)
I need your love (Know I will be there)
Oh, I need your love

I want your love ('Cuz I need your love)
I need your love ('cuz I need your love)
I want you in my life, baby
I want your love (yeah)
I need your love
Baby, baby, baby, follow me
Because I need you
Gotta have your love
I need you

I want your love
I need your love (oh, yeah)"
9	Heavy D	"Can I take a moment to tell you how I feel?
These words are not just lyrics, no, but they're oh so real
Let me tell you a story that happens everyday
How my Lord, He keeps making a way

Won't He make everything alright
Won't He make everything alright
Alright, alright, alright
He'll make it alright

Me and my wife tried to have a child
But all the doctors in town they just counted us out
It's been eight years in the making and I'm glad to say
I got me a little girl and another one on the way

He'll make it alright
From the mountain
In the valley low
I'll tell the world
Everywhere that I go
He'll make it alright
He'll make it alright"
